{
  "$schema": "https://json-schema.org/draft/2020-12/schema",
  "title": "SovereignReductionAlgebraResult",
  "type": "object",
  "required": [
    "schema_version",
    "timestamp_pt",
    "correctness",
    "engine"
  ],
  "properties": {
    "schema_version": {
      "type": "string"
    },
    "timestamp_pt": {
      "type": "string"
    },
    "engine": {
      "type": "object"
    },
    "correctness": {
      "type": "object"
    },
    "benchmarks": {
      "type": "array"
    },
    "goldilocks": {
      "type": "object"
    }
  }
}